{"$schema":"https://json-schema.org/draft/2020-12/schema","title":"AWA Composition Receipt v0.1","description":"","type":"object","required":["contract","receipt_id","profile","core","resolved_modules","module_versions","capability_policy","compatibility_result","source_hashes"],"properties":{"contract":{"const":"composition-receipt.v0.1"},"receipt_id":{"type":"string","minLength":1},"profile":{"type":"string","minLength":1},"core":{"type":"string","minLength":1},"resolved_modules":{"type":"array","items":{"type":"string","minLength":1},"uniqueItems":true},"module_versions":{"type":"object","additionalProperties":{"type":"string","pattern":"^v\\d+\\.\\d+$"}},"capability_policy":{"type":"object","additionalProperties":true},"compatibility_result":{"type":"string","enum":["pass","conditional","fail","unknown"]},"source_hashes":{"type":"object","additionalProperties":{"type":"string","pattern":"^[0-9a-f]{64}$"}}},"additionalProperties":false,"$id":"urn:awa:schema:composition-receipt-v0-1"}
